{"id":"docara.schema_reference","name":"schema_reference","renderer":"docara.schema_reference.v1","family":"docara_typed","category":"reference","lifecycle":"supported","authoring":{"syntax":"directive","call":":::schema_reference","jobs":["project_schema_field_reference"],"parameters":[{"name":"schema","type":"enum","required":true,"values":["site","section","page","presentation","framework-lock"]},{"name":"scope","type":"enum","required":true,"values":["site","section","page","shared","lock"]},{"name":"fields","type":"string","required":false,"default":""}]},"states":["populated"],"verification":{"renderer":true,"tests":true,"docs":true,"demo":true},"docs_ref":"docs/site/content/ru/settings.md","provenance":{"source_kind":"typed_definition","definition_ref":"resources/component-catalog/typed/docara.schema_reference.json"}}
