{"id":"docara.code","name":"code","renderer":"docara.code.v1","family":"docara_typed","category":"text_and_code","lifecycle":"supported","authoring":{"syntax":"directive","call":":::code","jobs":["include_external_code"],"parameters":[{"name":"src","type":"string","required":true},{"name":"lang","type":"string","required":false,"default":"text"},{"name":"lines","type":"string","required":false},{"name":"title","type":"string","required":false},{"name":"highlight","type":"string","required":false,"validation":{"pattern":"^[1-9][0-9]*(?:-[1-9][0-9]*)?(?:,[1-9][0-9]*(?:-[1-9][0-9]*)?)*$"}},{"name":"numbers","type":"string","required":false,"default":"false","validation":{"pattern":"^(?:true|false|[1-9][0-9]{0,5})$"}},{"name":"focus","type":"string","required":false,"validation":{"pattern":"^[1-9][0-9]*(?:-[1-9][0-9]*)?(?:,[1-9][0-9]*(?:-[1-9][0-9]*)?)*$"}},{"name":"layout","type":"enum","required":false,"values":["default","terminal"],"default":"default"},{"name":"region","type":"string","required":false,"validation":{"pattern":"^[A-Za-z0-9_.-]{1,64}$"}},{"name":"start_after","type":"string","required":false},{"name":"end_before","type":"string","required":false},{"name":"dedent","type":"boolean","required":false,"default":false}]},"states":[],"verification":{"renderer":true,"tests":true,"docs":true,"demo":true},"docs_ref":"docs/site/content/ru/components/code-from-file.md","provenance":{"source_kind":"typed_definition","definition_ref":"resources/component-catalog/typed/docara.code.json"}}
