{"id":"docara.tabs","name":"tabs","renderer":"docara.tabs.v1","family":"docara_typed","category":"documentation","lifecycle":"supported","authoring":{"syntax":"directive","call":":::tabs","jobs":["switch_between_equivalent_views"],"parameters":[]},"states":["selected","unselected"],"verification":{"renderer":true,"tests":true,"docs":true,"demo":true},"docs_ref":"docs/site/content/ru/components/tabs.md","provenance":{"source_kind":"typed_definition","definition_ref":"resources/component-catalog/typed/docara.tabs.json"}}
