{"id":"docara.diagram","name":"diagram","renderer":"docara.diagram.v1","family":"docara_typed","category":"technical_content","lifecycle":"supported","authoring":{"syntax":"directive","call":":::diagram","jobs":["render_declarative_diagram"],"parameters":[{"name":"engine","type":"enum","required":false,"default":"mermaid","values":["mermaid"]},{"name":"title","type":"string","required":false,"default":"Diagram"}]},"states":[],"verification":{"renderer":true,"tests":true,"docs":true,"demo":true},"docs_ref":"docs/site/content/ru/components/diagram.md","provenance":{"source_kind":"typed_definition","definition_ref":"resources/component-catalog/typed/docara.diagram.json"}}
