{"id":"docara.download","name":"download","renderer":"docara.download.v1","family":"docara_typed","category":"actions","lifecycle":"supported","authoring":{"syntax":"directive","call":":::download","jobs":["download_file"],"parameters":[{"name":"title","type":"string","required":false,"deprecated_names":["name"]},{"name":"format","type":"string","required":false},{"name":"file_size","type":"string","required":false,"deprecated_names":["size"]},{"name":"checksum","type":"string","required":false},{"name":"action","type":"enum","required":false,"default":"download","values":["download","open"]}]},"states":[],"verification":{"renderer":true,"tests":true,"docs":true,"demo":true},"docs_ref":"docs/site/content/ru/components/download.md","provenance":{"source_kind":"typed_definition","definition_ref":"resources/component-catalog/typed/docara.download.json"}}
