{"id":"docara.internal_preview","name":"internal_preview","renderer":"docara.internal_preview.v1","family":"docara_typed","category":"media","lifecycle":"supported","authoring":{"syntax":"directive","call":":::internal_preview","jobs":["preview_same_origin_page"],"parameters":[{"name":"size","type":"enum","required":false,"default":"normal","values":["compact","normal","tall"]},{"name":"title","type":"string","required":true}]},"states":["compact","normal","tall"],"verification":{"renderer":true,"tests":true,"docs":true,"demo":true},"docs_ref":"docs/site/content/ru/development/composition.md","provenance":{"source_kind":"typed_definition","definition_ref":"resources/component-catalog/typed/docara.internal_preview.json"}}
