{"id":"docara.figure","name":"figure","renderer":"docara.figure.v1","family":"docara_typed","category":"media","lifecycle":"supported","authoring":{"syntax":"directive","call":":::figure","jobs":["show_illustration_with_caption"],"parameters":[{"name":"ratio","type":"enum","required":false,"default":"auto","values":["auto","1/1","4/3","3/2","16/9","21/9"],"deprecated_values":{"1x1":"1/1","4x3":"4/3","3x2":"3/2","16x9":"16/9","21x9":"21/9"}},{"name":"fit","type":"enum","required":false,"default":"cover","values":["cover","contain"]}]},"states":[],"verification":{"renderer":true,"tests":true,"docs":true,"demo":true},"docs_ref":"docs/site/content/ru/components/figure.md","provenance":{"source_kind":"typed_definition","definition_ref":"resources/component-catalog/typed/docara.figure.json"}}
