{"id":"docara.example","name":"example","renderer":"docara.example.v1","family":"docara_typed","category":"documentation","lifecycle":"supported","authoring":{"syntax":"directive","call":":::example","jobs":["show_live_example_and_source"],"parameters":[{"name":"id","type":"string","required":false},{"name":"label","type":"string","required":false,"default":"Example"},{"name":"preview","type":"enum","required":false,"default":"auto","values":["auto","inline","sandbox"]},{"name":"fullscreen","type":"boolean","required":false},{"name":"wrap","type":"boolean","required":false}]},"states":[],"verification":{"renderer":true,"tests":true,"docs":true,"demo":true},"docs_ref":"docs/site/content/ru/components/example.md","provenance":{"source_kind":"typed_definition","definition_ref":"resources/component-catalog/typed/docara.example.json"}}
