{"id":"docara.alert","name":"alert","renderer":"docara.alert.v1","family":"docara_typed","category":"feedback","lifecycle":"supported","authoring":{"syntax":"directive","call":":::alert","jobs":["report_status"],"parameters":[{"name":"type","type":"enum","required":false,"default":"info","values":["clear","info","success","warning","danger"]},{"name":"variant","type":"enum","required":false,"default":"default","values":["default","flat","outlined"]}]},"states":["clear","info","success","warning","danger"],"verification":{"renderer":true,"tests":true,"docs":true,"demo":true},"docs_ref":"docs/site/content/ru/start/component-model.md","provenance":{"source_kind":"typed_definition","definition_ref":"resources/component-catalog/typed/docara.alert.json"}}
